{
  "$schema": "https://json-schema.org/draft/2020-12/schema",
  "$id": "https://sounddecisions.local/schemas/human-eval-v2-items.schema.json",
  "title": "SoundDecisions blinded human-evaluation item manifest",
  "type": "object",
  "additionalProperties": false,
  "required": [
    "schema_version",
    "instrument_version",
    "manifest_id",
    "status",
    "default_fps",
    "rubric",
    "counts",
    "items"
  ],
  "properties": {
    "schema_version": {"const": "sounddecisions-human-eval-items-v2-1.0"},
    "instrument_version": {"const": "human-eval-pack-1.0"},
    "manifest_id": {"const": "axis-spec-v2-candidate-curation-2026-07"},
    "status": {"const": "INCOMPLETE_ARTIFACTS_PRE_FREEZE_DO_NOT_RATE"},
    "default_fps": {"type": "number", "exclusiveMinimum": 0},
    "rubric": {
      "type": "object",
      "additionalProperties": false,
      "required": ["anchor", "presence", "two_event"],
      "properties": {
        "anchor": {"type": "string", "minLength": 1},
        "presence": {"type": "string", "minLength": 1},
        "two_event": {"type": "string", "minLength": 1}
      }
    },
    "counts": {
      "type": "object",
      "additionalProperties": false,
      "required": ["anchor_presence", "two_event", "total_tasks", "unique_videos"],
      "properties": {
        "anchor_presence": {"const": 30},
        "two_event": {"const": 60},
        "total_tasks": {"const": 90},
        "unique_videos": {"type": "integer", "minimum": 1}
      }
    },
    "items": {
      "type": "array",
      "minItems": 82,
      "maxItems": 82,
      "items": {
        "type": "object",
        "additionalProperties": false,
        "required": [
          "blind_id",
          "tasks",
          "media_path",
          "fps",
          "duration_s",
          "target_prompt"
        ],
        "properties": {
          "blind_id": {"type": "string", "pattern": "^HEV2-[0-9A-F]{12}$"},
          "tasks": {
            "type": "array",
            "minItems": 1,
            "maxItems": 2,
            "uniqueItems": true,
            "items": {"enum": ["anchor_presence", "two_event"]}
          },
          "media_path": {"type": "string", "pattern": "^media/HEV2-[0-9A-F]{12}\\.mp4$"},
          "fps": {"type": "number", "exclusiveMinimum": 0},
          "duration_s": {"type": "number", "exclusiveMinimum": 0},
          "target_prompt": {"type": "string", "minLength": 1}
        }
      }
    }
  }
}
