{
  "schema_version": "sounddecisions-human-eval-items-v2-1.0",
  "instrument_version": "human-eval-pack-1.0",
  "manifest_id": "axis-spec-v2-candidate-curation-2026-07",
  "status": "INCOMPLETE_ARTIFACTS_PRE_FREEZE_DO_NOT_RATE",
  "default_fps": 30.0,
  "rubric": {
    "anchor": "Mark the closed visual-event interval [start, end]. Use Too uncertain when a defensible interval cannot be marked.",
    "presence": "For one specified visible event, determine whether a corresponding audio event occurs near its anchor: present, absent, or uncertain. Salient unrelated background audio does not count. The unit is the event.",
    "two_event": "Confirm only when two separable target events exist, then mark one closed visual interval for each event; otherwise reject the item."
  },
  "counts": {
    "anchor_presence": 30,
    "two_event": 60,
    "total_tasks": 90,
    "unique_videos": 82
  },
  "items": [
    {
      "blind_id": "HEV2-6D944D47EF85",
      "tasks": [
        "anchor_presence"
      ],
      "media_path": "media/HEV2-6D944D47EF85.mp4",
      "fps": 24.0,
      "duration_s": 10.041016,
      "target_prompt": "Identify and briefly describe the visible target event before marking it."
    },
    {
      "blind_id": "HEV2-DD5E7196F93D",
      "tasks": [
        "anchor_presence",
        "two_event"
      ],
      "media_path": "media/HEV2-DD5E7196F93D.mp4",
      "fps": 29.97002997002997,
      "duration_s": 10.043,
      "target_prompt": "Complete the single-event and two-event curation tasks for this clip."
    },
    {
      "blind_id": "HEV2-3A7CFEAEF852",
      "tasks": [
        "anchor_presence"
      ],
      "media_path": "media/HEV2-3A7CFEAEF852.mp4",
      "fps": 50.0,
      "duration_s": 10.0,
      "target_prompt": "Identify and briefly describe the visible target event before marking it."
    },
    {
      "blind_id": "HEV2-B9B13B0D1BF1",
      "tasks": [
        "anchor_presence"
      ],
      "media_path": "media/HEV2-B9B13B0D1BF1.mp4",
      "fps": 30.0,
      "duration_s": 10.0,
      "target_prompt": "Identify and briefly describe the visible target event before marking it."
    },
    {
      "blind_id": "HEV2-C1CE4A975F2C",
      "tasks": [
        "anchor_presence"
      ],
      "media_path": "media/HEV2-C1CE4A975F2C.mp4",
      "fps": 30.0,
      "duration_s": 10.0,
      "target_prompt": "Identify and briefly describe the visible target event before marking it."
    },
    {
      "blind_id": "HEV2-B256CACCF46E",
      "tasks": [
        "anchor_presence",
        "two_event"
      ],
      "media_path": "media/HEV2-B256CACCF46E.mp4",
      "fps": 29.97002997002997,
      "duration_s": 10.01,
      "target_prompt": "Complete the single-event and two-event curation tasks for this clip."
    },
    {
      "blind_id": "HEV2-C6786BF51163",
      "tasks": [
        "anchor_presence"
      ],
      "media_path": "media/HEV2-C6786BF51163.mp4",
      "fps": 29.97002997002997,
      "duration_s": 10.043,
      "target_prompt": "Identify and briefly describe the visible target event before marking it."
    },
    {
      "blind_id": "HEV2-52E51F279DF5",
      "tasks": [
        "anchor_presence"
      ],
      "media_path": "media/HEV2-52E51F279DF5.mp4",
      "fps": 29.922,
      "duration_s": 10.026068,
      "target_prompt": "Identify and briefly describe the visible target event before marking it."
    },
    {
      "blind_id": "HEV2-5A0DF886184B",
      "tasks": [
        "anchor_presence",
        "two_event"
      ],
      "media_path": "media/HEV2-5A0DF886184B.mp4",
      "fps": 29.97002997002997,
      "duration_s": 9.009,
      "target_prompt": "Complete the single-event and two-event curation tasks for this clip."
    },
    {
      "blind_id": "HEV2-D41A3BB94040",
      "tasks": [
        "anchor_presence"
      ],
      "media_path": "media/HEV2-D41A3BB94040.mp4",
      "fps": 23.976023976023978,
      "duration_s": 10.01,
      "target_prompt": "Identify and briefly describe the visible target event before marking it."
    },
    {
      "blind_id": "HEV2-FB32150363BB",
      "tasks": [
        "anchor_presence",
        "two_event"
      ],
      "media_path": "media/HEV2-FB32150363BB.mp4",
      "fps": 29.97002997002997,
      "duration_s": 9.009,
      "target_prompt": "Complete the single-event and two-event curation tasks for this clip."
    },
    {
      "blind_id": "HEV2-BDACDF4AAF21",
      "tasks": [
        "anchor_presence"
      ],
      "media_path": "media/HEV2-BDACDF4AAF21.mp4",
      "fps": 25.0,
      "duration_s": 9.04,
      "target_prompt": "Identify and briefly describe the visible target event before marking it."
    },
    {
      "blind_id": "HEV2-75BCF299CC4B",
      "tasks": [
        "anchor_presence"
      ],
      "media_path": "media/HEV2-75BCF299CC4B.mp4",
      "fps": 29.97002997002997,
      "duration_s": 9.009,
      "target_prompt": "Identify and briefly describe the visible target event before marking it."
    },
    {
      "blind_id": "HEV2-E7BCEEAC3AC0",
      "tasks": [
        "anchor_presence"
      ],
      "media_path": "media/HEV2-E7BCEEAC3AC0.mp4",
      "fps": 30.0,
      "duration_s": 8.0,
      "target_prompt": "Identify and briefly describe the visible target event before marking it."
    },
    {
      "blind_id": "HEV2-1615DB411EB5",
      "tasks": [
        "anchor_presence"
      ],
      "media_path": "media/HEV2-1615DB411EB5.mp4",
      "fps": 23.976023976023978,
      "duration_s": 9.05,
      "target_prompt": "Identify and briefly describe the visible target event before marking it."
    },
    {
      "blind_id": "HEV2-4445DE0A0704",
      "tasks": [
        "anchor_presence",
        "two_event"
      ],
      "media_path": "media/HEV2-4445DE0A0704.mp4",
      "fps": 23.976023976023978,
      "duration_s": 8.008,
      "target_prompt": "Complete the single-event and two-event curation tasks for this clip."
    },
    {
      "blind_id": "HEV2-8A96981CDD45",
      "tasks": [
        "anchor_presence"
      ],
      "media_path": "media/HEV2-8A96981CDD45.mp4",
      "fps": 29.97002997002997,
      "duration_s": 8.008,
      "target_prompt": "Identify and briefly describe the visible target event before marking it."
    },
    {
      "blind_id": "HEV2-777E678E5CCD",
      "tasks": [
        "anchor_presence",
        "two_event"
      ],
      "media_path": "media/HEV2-777E678E5CCD.mp4",
      "fps": 23.976023976023978,
      "duration_s": 10.01,
      "target_prompt": "Complete the single-event and two-event curation tasks for this clip."
    },
    {
      "blind_id": "HEV2-FED09A886D19",
      "tasks": [
        "anchor_presence"
      ],
      "media_path": "media/HEV2-FED09A886D19.mp4",
      "fps": 29.97002997002997,
      "duration_s": 10.043,
      "target_prompt": "Identify and briefly describe the visible target event before marking it."
    },
    {
      "blind_id": "HEV2-338184E5B84D",
      "tasks": [
        "anchor_presence",
        "two_event"
      ],
      "media_path": "media/HEV2-338184E5B84D.mp4",
      "fps": 23.976,
      "duration_s": 10.01001,
      "target_prompt": "Complete the single-event and two-event curation tasks for this clip."
    },
    {
      "blind_id": "HEV2-0E86366C6C12",
      "tasks": [
        "anchor_presence"
      ],
      "media_path": "media/HEV2-0E86366C6C12.mp4",
      "fps": 25.0,
      "duration_s": 10.04,
      "target_prompt": "Identify and briefly describe the visible target event before marking it."
    },
    {
      "blind_id": "HEV2-871CE71F78A0",
      "tasks": [
        "anchor_presence",
        "two_event"
      ],
      "media_path": "media/HEV2-871CE71F78A0.mp4",
      "fps": 29.97002997002997,
      "duration_s": 10.043,
      "target_prompt": "Complete the single-event and two-event curation tasks for this clip."
    },
    {
      "blind_id": "HEV2-7EFA31601B19",
      "tasks": [
        "anchor_presence"
      ],
      "media_path": "media/HEV2-7EFA31601B19.mp4",
      "fps": 24.0,
      "duration_s": 9.041016,
      "target_prompt": "Identify and briefly describe the visible target event before marking it."
    },
    {
      "blind_id": "HEV2-44DFA4D96C5C",
      "tasks": [
        "anchor_presence"
      ],
      "media_path": "media/HEV2-44DFA4D96C5C.mp4",
      "fps": 23.976023976023978,
      "duration_s": 10.01,
      "target_prompt": "Identify and briefly describe the visible target event before marking it."
    },
    {
      "blind_id": "HEV2-93236453DEA3",
      "tasks": [
        "anchor_presence"
      ],
      "media_path": "media/HEV2-93236453DEA3.mp4",
      "fps": 23.976023976023978,
      "duration_s": 10.01,
      "target_prompt": "Identify and briefly describe the visible target event before marking it."
    },
    {
      "blind_id": "HEV2-93BA3B95EB7D",
      "tasks": [
        "anchor_presence"
      ],
      "media_path": "media/HEV2-93BA3B95EB7D.mp4",
      "fps": 25.0,
      "duration_s": 10.04,
      "target_prompt": "Identify and briefly describe the visible target event before marking it."
    },
    {
      "blind_id": "HEV2-3CF5EDECF196",
      "tasks": [
        "anchor_presence"
      ],
      "media_path": "media/HEV2-3CF5EDECF196.mp4",
      "fps": 25.0,
      "duration_s": 10.0,
      "target_prompt": "Identify and briefly describe the visible target event before marking it."
    },
    {
      "blind_id": "HEV2-B2B4801CEABE",
      "tasks": [
        "anchor_presence"
      ],
      "media_path": "media/HEV2-B2B4801CEABE.mp4",
      "fps": 29.97002997002997,
      "duration_s": 8.008,
      "target_prompt": "Identify and briefly describe the visible target event before marking it."
    },
    {
      "blind_id": "HEV2-E048CAF40A62",
      "tasks": [
        "anchor_presence"
      ],
      "media_path": "media/HEV2-E048CAF40A62.mp4",
      "fps": 25.0,
      "duration_s": 8.04,
      "target_prompt": "Identify and briefly describe the visible target event before marking it."
    },
    {